{
  "schema_version": "1.0",
  "metadata": {
    "pipeline_run_id": "1749778320931703",
    "timestamp": "2025-06-13T01:32:06Z",
    "pipeline_version": "4b80585b",
    "environment": "test",
    "dry_run": true
  },
  "evaluation_results": {
    "baseline_metrics": {
      "accuracy": 0.854492577162388,
      "precision": 0.8269597141976298,
      "recall": 0.8867579571571691,
      "f1": 0.8389452328858691,
      "auroc": 0.9043036674794087
    },
    "new_metrics": {
      "accuracy": 0.8840483940124245,
      "precision": 0.8540146403183947,
      "recall": 0.913400333131719,
      "f1": 0.8911018964512049,
      "auroc": 0.9346795551019627
    },
    "benchmark_metadata": {
      "size": 1000,
      "type": "mock_classification_benchmark",
      "features": [
        "feature_1",
        "feature_2",
        "feature_3"
      ],
      "dataset_hash": "569d089873e119f50f83d4c00429932b389988218eaafeda6de36ab971993df1"
    },
    "evaluation_timestamp": "2025-06-13T01:32:05Z",
    "evaluation_time_seconds": 0.002335071563720703
  },
  "delta_computation": {
    "delta_one_score": 0.033157134026648195,
    "metric_deltas": {
      "auroc": {
        "baseline_value": 0.9043036674794087,
        "new_value": 0.9346795551019627,
        "absolute_delta": 0.030375887622553943,
        "relative_delta": 0.03359036208182315,
        "improvement": true
      },
      "precision": {
        "baseline_value": 0.8269597141976298,
        "new_value": 0.8540146403183947,
        "absolute_delta": 0.027054926120764877,
        "relative_delta": 0.032716135570177475,
        "improvement": true
      },
      "accuracy": {
        "baseline_value": 0.854492577162388,
        "new_value": 0.8840483940124245,
        "absolute_delta": 0.029555816850036498,
        "relative_delta": 0.0345887344606151,
        "improvement": true
      },
      "f1": {
        "baseline_value": 0.8389452328858691,
        "new_value": 0.8911018964512049,
        "absolute_delta": 0.05215666356533577,
        "relative_delta": 0.06216933063189741,
        "improvement": true
      },
      "recall": {
        "baseline_value": 0.8867579571571691,
        "new_value": 0.913400333131719,
        "absolute_delta": 0.02664237597454988,
        "relative_delta": 0.0300446990743245,
        "improvement": true
      }
    },
    "computation_method": "weighted_average_delta",
    "metrics_included": [
      "auroc",
      "precision",
      "accuracy",
      "f1",
      "recall"
    ],
    "improved_metrics": [
      "auroc",
      "precision",
      "accuracy",
      "f1",
      "recall"
    ],
    "degraded_metrics": []
  },
  "models": {
    "baseline": {
      "model_id": "1.0.0",
      "model_type": "mock_model",
      "model_hash": "0623986d9e6af64622e4aeac028cdb2735e562f4343a39c1d0ea99b66ee30b3f",
      "training_config_hash": "44136fa355b3678a1146ad16f7e8649e94fb4fc21fe77e8310c060f61caaff8a",
      "mlflow_run_id": null,
      "metrics": {
        "accuracy": 0.854492577162388,
        "precision": 0.8269597141976298,
        "recall": 0.8867579571571691,
        "f1": 0.8389452328858691,
        "auroc": 0.9043036674794087
      }
    },
    "new": {
      "model_id": "2.0.0",
      "model_type": "mock_hokusai_integrated_classifier",
      "model_hash": "b102a2c884fd78efe3bba1d89f07780af2f8ca33528d4fcb5f89f4bce8b99c04",
      "training_config_hash": "24f5f221e0b7d4a5e21ad3059f493b2f79d98603b831e4917dcef8a97995a89d",
      "mlflow_run_id": "0a8f397b79c04447a432d98ec2bb1c01",
      "metrics": {
        "accuracy": 0.8840483940124245,
        "precision": 0.8540146403183947,
        "recall": 0.913400333131719,
        "f1": 0.8911018964512049,
        "auroc": 0.9346795551019627
      },
      "training_metadata": {
        "base_samples": 500,
        "contributed_samples": 100,
        "contribution_ratio": 0.16666666666666666,
        "data_manifest": {
          "source_path": "data/test_fixtures/test_queries.csv",
          "row_count": 100,
          "column_count": 6,
          "columns": [
            "query_id",
            "query_text",
            "feature_1",
            "feature_2",
            "feature_3",
            "label"
          ],
          "data_hash": "3b26f05d3923476fb7eeedd1bee22e4e6b8c19566fe0f61f45c7ea48d7242e7e",
          "dtypes": {
            "query_id": "object",
            "query_text": "object",
            "feature_1": "float64",
            "feature_2": "float64",
            "feature_3": "float64",
            "label": "int64"
          },
          "null_counts": {
            "query_id": 0,
            "query_text": 0,
            "feature_1": 0,
            "feature_2": 0,
            "feature_3": 0,
            "label": 0
          },
          "unique_counts": {
            "query_id": 100,
            "query_text": 100,
            "feature_1": 100,
            "feature_2": 100,
            "feature_3": 100,
            "label": 2
          }
        }
      }
    }
  },
  "contributor_info": {
    "data_hash": "3b26f05d3923476fb7eeedd1bee22e4e6b8c19566fe0f61f45c7ea48d7242e7e",
    "data_manifest": {
      "source_path": "data/test_fixtures/test_queries.csv",
      "row_count": 100,
      "column_count": 6,
      "columns": [
        "query_id",
        "query_text",
        "feature_1",
        "feature_2",
        "feature_3",
        "label"
      ],
      "data_hash": "3b26f05d3923476fb7eeedd1bee22e4e6b8c19566fe0f61f45c7ea48d7242e7e",
      "dtypes": {
        "query_id": "object",
        "query_text": "object",
        "feature_1": "float64",
        "feature_2": "float64",
        "feature_3": "float64",
        "label": "int64"
      },
      "null_counts": {
        "query_id": 0,
        "query_text": 0,
        "feature_1": 0,
        "feature_2": 0,
        "feature_3": 0,
        "label": 0
      },
      "unique_counts": {
        "query_id": 100,
        "query_text": 100,
        "feature_1": 100,
        "feature_2": 100,
        "feature_3": 100,
        "label": 2
      }
    },
    "contributor_weights": 0.16666666666666666,
    "contributed_samples": 100,
    "total_samples": 600,
    "validation_status": "valid"
  },
  "attestation": {
    "hash_tree_root": "1a193621756d8ee11cef0c3bd765ed4eb01f4f3f64f1137bf7b69ca147096df8",
    "proof_ready": true,
    "signature_blob": null,
    "verification_key": null,
    "proof_system": "none",
    "circuit_hash": null,
    "public_inputs_hash": "93e850461a109d23623fda07f33eee78957bcaaf02ede16f3e8ea2d5d074c2b8"
  }
}